{
  "schemaVersion": 1,
  "kind": "apply-set",
  "runId": "run-2026-06-09-0001",
  "repo": {
    "owner": "ArchonVII",
    "name": "consumer-repo",
    "defaultBranch": "main",
    "baseSha": "deadbeefdeadbeefdeadbeefdeadbeefdeadbeef"
  },
  "sourceDecisionDoc": {
    "fingerprint": "0123456701234567012345670123456701234567012345670123456701234567",
    "issueNumber": 123
  },
  "items": [
    {
      "itemId": "agents/AGENTS.md#2026-01-01-review-block",
      "category": "agents",
      "regionId": "2026-01-01-review-block",
      "file": "AGENTS.md",
      "resolution": "apply-central",
      "expectedFileSha256": "cafebabecafebabecafebabecafebabecafebabecafebabecafebabecafebabe",
      "expectedRegionInnerSha256": "feedfacefeedfacefeedfacefeedfacefeedfacefeedfacefeedfacefeedface",
      "writePlan": { "kind": "replace-region", "sourceCatalogId": "2026-01-01-review-block" }
    },
    {
      "itemId": "agents/AGENTS.md#mystery-block",
      "category": "agents",
      "regionId": "mystery-block",
      "file": ".archon/region-ownership.json",
      "resolution": "keep-local",
      "expectedFileSha256": null,
      "expectedRegionInnerSha256": null,
      "writePlan": { "kind": "record-ownership" }
    }
  ],
  "guards": {
    "allowAutoMerge": true,
    "allowedPathPatterns": ["AGENTS.md", "**/AGENTS.md", ".archon/region-ownership.json"],
    "requiredConfirmationPhraseHash": "abcdef01abcdef01abcdef01abcdef01abcdef01abcdef01abcdef01abcdef01"
  }
}
